"key","title","year","month","day","journal","issn","volume","issue","pages","authors","url","language","publisher","location","abstract","notes","doi","keywords","pubmed_id","pmc_id"
"rayyan-100677955","Urban Vegetation Mapping from Aerial Imagery Using Explainable AI (XAI)",NA,1,1,NA,NA,NA,NA,NA,NA,NA,"en",NA,NA,"Urban vegetation mapping is critical in many applications, i.e., preserving biodiversity, maintaining ecological balance, and minimizing the urban heat island effect. It is still challenging to extract accurate vegetation covers from aerial imagery using traditional classification approaches, because urban vegetation categories have complex spatial structures and similar spectral properties. Deep neural networks (DNNs) have shown a significant improvement in remote sensing image classification outcomes during the last few years. These methods are promising in this domain, yet unreliable for various reasons, such as the use of irrelevant descriptor features in the building of the models and lack of quality in the labeled image. Explainable AI (XAI) can help us gain insight into these limits and, as a result, adjust the training dataset and model as needed. Thus, in this work, we explain how an explanation model called Shapley additive explanations (SHAP) can be utilized for interpreting the output of the DNN model that is designed for classifying vegetation covers. We want to not only produce high-quality vegetation maps, but also rank the input parameters and select appropriate features for classification. Therefore, we test our method on vegetation mapping from aerial imagery based on spectral and textural features. Texture features can help overcome the limitations of poor spectral resolution in aerial imagery for vegetation mapping. The model was capable of obtaining an overall accuracy (OA) of 94.44% for vegetation cover mapping. The conclusions derived from SHAP plots demonstrate the high contribution of features, such as Hue, Brightness, GLCM_Dissimilarity, GLCM_Homogeneity, and GLCM_Mean to the output of the proposed model for vegetation mapping. Therefore, the study indicates that existing vegetation mapping strategies based only on spectral characteristics are insufficient to appropriately classify vegetation covers.","RAYYAN-INCLUSION: {""Erik""=>""Included""} | RAYYAN-LABELS: urban","https://doi.org/10.3390/s21144738",NA,NA,NA
"rayyan-100678040","Impacts of urbanization and long-term meteorological variations on global PM2.5 and its associated health burden",NA,1,1,NA,NA,NA,NA,NA,NA,NA,"en",NA,NA,"","RAYYAN-INCLUSION: {""Erik""=>""Included""} | RAYYAN-LABELS: urban | USER-NOTES: {""Maria""=>[""PM2.5 pollution has adverse health effects on humans. Urbanization and long-term meteorological variations play important roles in influencing the PM2.5 concentration and its associated health effects. Our results indicate that the urbanization process can enhance the PM2.5 concentration globally. The PM2.5-caused mortality density (deaths/100 km2) is also positively correlated with the urbanization degree in both developed and developing countries. "", ""The results from machine learning technique revealed that the meteorology-driven variation in PM2.5-caused health burden has increased with the increase in the urbanization degree from 1980 to 2018, suggesting that residents living in urban areas are more vulnerable to experiencing unfavorable meteorological conditions (e.g. low wind speed and planetary boundary layer height). The maximum difference in PM2.5-caused mortality due to the variation in annual meteorological conditions (between 2013 and 1986) was 270 600 (196 800–317 900). Our findings indicate an urgent need to understand the driving force behind the appearance of unfavorable meteorological situations and propose suitable climate mitigation measures.""]}","https://doi.org/10.1016/j.envpol.2020.116003",NA,NA,NA
"rayyan-100678047","Environmentally sustainable smart cities and their converging AI, IoT, and big data technologies and solutions: an integrated approach to an extensive literature review",NA,1,1,NA,NA,NA,NA,NA,NA,NA,"en",NA,NA,"Abstract There have recently been intensive efforts aimed at addressing the challenges of environmental degradation and climate change through the applied innovative solutions of AI, IoT, and Big Data. Given the synergistic potential of these advanced technologies, their convergence is being embraced and leveraged by smart cities in an attempt to make progress toward reaching the environmental targets of sustainable development goals under what has been termed “environmentally sustainable smart cities.” This new paradigm of urbanism represents a significant research gap in and of itself. To fill this gap, this study explores the key research trends and driving factors of environmentally sustainable smart cities and maps their thematic evolution. Further, it examines the fragmentation, amalgamation, and transition of their underlying models of urbanism as well as their converging AI, IoT, and Big Data technologies and solutions. It employs and combines bibliometric analysis and evidence synthesis methods. A total of 2,574 documents were collected from the Web of Science database and compartmentalized into three sub-periods: 1991–2015, 2016–2019, and 2020–2021. The results show that environmentally sustainable smart cities are a rapidly growing trend that markedly escalated during the second and third periods—due to the acceleration of the digitalization and decarbonization agendas—thanks to COVID-19 and the rapid advancement of data-driven technologies. The analysis also reveals that, while the overall priority research topics have been dynamic over time—some AI models and techniques and environmental sustainability areas have received more attention than others. The evidence synthesized indicates that the increasing criticism of the fragmentation of smart cities and sustainable cities, the widespread diffusion of the SDGs agenda, and the dominance of advanced ICT have significantly impacted the materialization of environmentally sustainable smart cities, thereby influencing the landscape and dynamics of smart cities. It also suggests that the convergence of AI, IoT, and Big Data technologies provides new approaches to tackling the challenges of environmental sustainability. However, these technologies involve environmental costs and pose ethical risks and regulatory conundrums. The findings can inform scholars and practitioners of the emerging data-driven technology solutions of smart cities, as well as assist policymakers in designing and implementing responsive environmental policies.","RAYYAN-INCLUSION: {""Erik""=>""Included""} | RAYYAN-LABELS: urban","https://doi.org/10.1186/s42162-023-00259-2",NA,NA,NA
"rayyan-100678071","The potential of geospatial analysis and Bayesian networks to enable i-Tree Eco assessment of existing tree inventories",NA,1,1,NA,NA,NA,NA,NA,NA,NA,"en",NA,NA,"Valuing the ecosystem services of urban trees is important for gaining public and political support for urban tree conservation and maintenance. The i-Tree Eco software application can be used to estimate regulating ecosystem services provided by urban forests. However, existing municipal tree inventories may not contain data necessary for running i-Tree Eco and manual field surveys are costly and time consuming. Using a tree inventory of Oslo, Norway, as an example, we demonstrate the potential of geospatial and machine learning methods to supplement missing and incomplete i-Tree Eco attributes in existing municipal inventories for the purpose of rapid low-cost urban ecosystem accounting. We correlate manually surveyed stem diameter and crown dimensions derived from airborne laser scanning imagery to complete most structural attributes. We then use auxiliary spatial datasets to derive missing attributes of trees’ spatial context and include differentiation of air pollution levels. The integration of Oslo’s tree inventory with available spatial data increases the proportion of records suitable for i-Tree Eco analysis from 19 % to 54 %. Furthermore, we illustrate how machine learning with Bayesian networks can be used to extrapolate i-Tree Eco outputs and infer the value of the entire municipal inventory. We find the expected total asset value of municipal trees in Oslo to be 38.5–43.4 million USD, depending on different modelling assumptions. We argue that there is a potential for greater use of geospatial methods in compiling information for valuation of urban tree inventories, especially when assessing location-specific tree characteristics, and for more spatially sensitive scaling methods for determining asset values of urban forests for the purpose of awareness-raising. However, given the available data in our case, we question the accuracy of values inferred by Bayesian networks in relation to the purposes of ecosystem accounting and tree compensation valuation.","RAYYAN-INCLUSION: {""Erik""=>""Included""} | RAYYAN-LABELS: urban","https://doi.org/10.1016/j.ufug.2020.126801",NA,NA,NA
"rayyan-100678096","Disruptive Technologies in Smart Farming: An Expanded View with Sentiment Analysis",NA,1,1,NA,NA,NA,NA,NA,NA,NA,"en",NA,NA,"Smart Farming (SF) is an emerging technology in the current agricultural landscape. The aim of Smart Farming is to provide tools for various agricultural and farming operations to improve yield by reducing cost, waste, and required manpower. SF is a data-driven approach that can mitigate losses that occur due to extreme weather conditions and calamities. The influx of data from various sensors, and the introduction of information communication technologies (ICTs) in the field of farming has accelerated the implementation of disruptive technologies (DTs) such as machine learning and big data. Application of these predictive and innovative tools in agriculture is crucial for handling unprecedented conditions such as climate change and the increasing global population. In this study, we review the recent advancements in the field of Smart Farming, which include novel use cases and projects around the globe. An overview of the challenges associated with the adoption of such technologies in their respective regions is also provided. A brief analysis of the general sentiment towards Smart Farming technologies is also performed by manually annotating YouTube comments and making use of the pattern library. Preliminary findings of our study indicate that, though there are several barriers to the implementation of SF tools, further research and innovation can alleviate such risks and ensure sustainability of the food supply. The exploratory sentiment analysis also suggests that most digital users are not well-informed about such technologies.","RAYYAN-INCLUSION: {""Erik""=>""Included""} | RAYYAN-LABELS: urban","https://doi.org/10.3390/agriengineering4020029",NA,NA,NA
"rayyan-100678129","Impact‐Based Forecasting for Pluvial Floods",NA,1,1,NA,NA,NA,NA,NA,NA,NA,"en",NA,NA,"Abstract Pluvial floods in urban areas are caused by local, fast storm events with very high rainfall rates, which lead to inundation of streets and buildings before the storm water reaches a watercourse. An increase in frequency and intensity of heavy rainfall events and an ongoing urbanization may further increase the risk of pluvial flooding in many urban areas. Currently, warnings for pluvial floods are mostly limited to information on rainfall intensities and durations over larger areas, which is often not detailed enough to effectively protect people and goods. We present a proof‐of‐concept for an impact‐based forecasting system for pluvial floods. Using a model chain consisting of a rainfall forecast, an inundation, a contaminant transport and a damage model, we are able to provide predictions for the expected rainfall, the inundated areas, spreading of potential contamination and the expected damage to residential buildings. We use a neural network‐based inundation model, which significantly reduces the computation time of the model chain. To demonstrate the feasibility, we perform a hindcast of a recent pluvial flood event in an urban area in Germany. The required spatio‐temporal accuracy of rainfall forecasts is still a major challenge, but our results show that reliable impact‐based warnings can be forecasts are available up to 5 min before the peak of an extreme rainfall event. Based on our results, we discuss how the outputs of the impact‐based forecast could be used to disseminate impact‐based early warnings.","RAYYAN-INCLUSION: {""Erik""=>""Included""} | RAYYAN-LABELS: urban","https://doi.org/10.1029/2020ef001851",NA,NA,NA
"rayyan-100678142","Quantification and Modelling of Fugitive Greenhouse Gas Emissions from Urban Water Systems",NA,1,1,NA,NA,NA,NA,NA,NA,NA,"en",NA,NA,"Abstract With increased commitment from the international community to reduce greenhouse gas (GHG) emissions from all sectors in accordance with the Paris Agreement, the water sector has never felt the pressure it is now under to transition to a low-carbon water management model. This requires reducing GHG emissions from grid-energy consumption (Scope 2 emissions), which is straightforward; however, it also requires reducing Scope 1 emissions, which include nitrous oxide and methane emissions, predominantly from wastewater handling and treatment. The pathways and factors leading to biological nitrous oxide and methane formation and emissions from wastewater are highly complex and site-specific. Good emission factors for estimating the Scope 1 emissions are lacking, water utilities have little experience in directly measuring these emissions, and the mathematical modelling of these emissions is challenging. Therefore, this book aims to help the water sector address the Scope 1 emissions by breaking down their pathways and influencing factors, and providing guidance on both the use of emission factors, and performing direct measurements of nitrous oxide and methane emissions from sewers and wastewater treatment plants. The book also dives into the mathematical modelling for predicting these emissions and provides guidance on the use of different mathematical models based upon your conditions, as well as an introduction to alternative modelling methods, including metabolic, data-driven, and AI methods. Finally, the book includes guidance on using the modelling tools for assessing different operating strategies and identifying promising mitigation actions. A must-have book for anyone needing to understand, account for, and reduce water utility Scope 1 emissions. ISBN: 9781789060454 (Paperback) ISBN: 9781789060461 (eBook) ISBN: 9781789060478 (ePub)","RAYYAN-INCLUSION: {""Erik""=>""Included""} | RAYYAN-LABELS: urban","https://doi.org/10.2166/9781789060461",NA,NA,NA
"rayyan-130074849","Convergence of blockchain and artificial intelligence in IoT network for the sustainable smart city",NA,1,1,NA,NA,NA,NA,NA,NA,NA,"en",NA,NA,"","RAYYAN-INCLUSION: {""Maria""=>""Included""} | RAYYAN-LABELS: urban | USER-NOTES: {""Maria""=>[""In the digital era, the smart city can become an intelligent society by utilizing advances in emerging technologies. Specifically, the rapid adoption of blockchain technology has led a paradigm shift to a new digital smart city ecosystem. A broad spectrum of blockchain applications promise solutions for problems in areas ranging from risk management and financial services to cryptocurrency, and from the Internet of Things (IoT) to public and social services. Furthermore, the convergence of Artificial Intelligence (AI) and blockchain technology is revolutionizing the smart city network architecture to build sustainable ecosystems. However, these advancements in technologies bring both opportunities and challenges when it comes to achieving the goals of creating a sustainable smart cities. "", ""This paper provides a comprehensive literature review of the security issues and problems that impact the deployment of blockchain systems in smart cities. This work presents a detailed discussion of several key factors for the convergence of Blockchain and AI technologies that will help form a sustainable smart society. We discuss blockchain security enhancement solutions, summarizing the key points that can be used for developing various blockchain-AI based intelligent transportation systems. Also, we discuss the issues that remain open and our future research direction, this includes new security suggestions and future guidelines for a sustainable smart city ecosystem.""]}","https://doi.org/10.1016/j.scs.2020.102364",NA,NA,NA
"rayyan-130074850","The Sustainability of Artificial Intelligence: An Urbanistic Viewpoint from the Lens of Smart and Sustainable Cities",NA,1,1,NA,NA,NA,NA,NA,NA,NA,"en",NA,NA,"The popularity and application of artificial intelligence (AI) are increasing rapidly all around the world—where, in simple terms, AI is a technology which mimics the behaviors commonly associated with human intelligence. Today, various AI applications are being used in areas ranging from marketing to banking and finance, from agriculture to healthcare and security, from space exploration to robotics and transport, and from chatbots to artificial creativity and manufacturing. More recently, AI applications have also started to become an integral part of many urban services. Urban artificial intelligences manage the transport systems of cities, run restaurants and shops where every day urbanity is expressed, repair urban infrastructure, and govern multiple urban domains such as traffic, air quality monitoring, garbage collection, and energy. In the age of uncertainty and complexity that is upon us, the increasing adoption of AI is expected to continue, and so its impact on the sustainability of our cities. This viewpoint explores and questions the sustainability of AI from the lens of smart and sustainable cities, and generates insights into emerging urban artificial intelligences and the potential symbiosis between AI and a smart and sustainable urbanism. In terms of methodology, this viewpoint deploys a thorough review of the current status of AI and smart and sustainable cities literature, research, developments, trends, and applications. In so doing, it contributes to existing academic debates in the fields of smart and sustainable cities and AI. In addition, by shedding light on the uptake of AI in cities, the viewpoint seeks to help urban policymakers, planners, and citizens make informed decisions about a sustainable adoption of AI.","RAYYAN-INCLUSION: {""Maria""=>""Included""} | RAYYAN-LABELS: urban","https://doi.org/10.3390/su12208548",NA,NA,NA
"rayyan-130074851","Urban water resource management for sustainable environment planning using artificial intelligence techniques",NA,1,1,NA,NA,NA,NA,NA,NA,NA,"en",NA,NA,"","RAYYAN-INCLUSION: {""Maria""=>""Included""} | RAYYAN-LABELS: urban | USER-NOTES: {""Maria""=>[""In the current era, water is a significant resource for socio-economic growth and the protection of healthy environments. Properly controlled water resources are considered a vital part of development, which reduces poverty and equity. Conventional Water system Management maximizes the existing water flows available to satisfy all competing demands, including on-site water and groundwater. Therefore, Climatic change would intensify the specific challenges in water resource management by contributing to uncertainty. Sustainable water resources management is an essential process for ensuring the earth's life and the future. Nonlinear effects, stochastic dynamics, and hydraulic constraints are challenging in ecological planning for sustainable water development. In this paper, Adaptive Intelligent Dynamic Water Resource Planning (AIDWRP) has been proposed to sustain the urban areas' water environment."", ""Here, an adaptive intelligent approach is a subset of the Artificial Intelligence (AI) technique in which environmental planning for sustainable water development has been modeled effectively. Artificial intelligence modeling improves water efficiency by transforming information into a leaner process, improving decision-making based on data-driven by combining numeric AI tools and human intellectual skills. In AIDWRP, Markov Decision Process (MDP) discusses the dynamic water resource management issue with annual use and released locational constraints that develop sensitivity-driven methods to optimize several efficient environmental planning and management policies. Consequently, there is a specific relief from the engagement of supply and demand for water resources, and substantial improvements in local economic efficiency have been simulated with numerical outcomes.""]}","https://doi.org/10.1016/j.eiar.2020.106515",NA,NA,NA
"rayyan-130074852","Green Artificial Intelligence: Towards an Efficient, Sustainable and Equitable Technology for Smart Cities and Futures",NA,1,1,NA,NA,NA,NA,NA,NA,NA,"en",NA,NA,"Smart cities and artificial intelligence (AI) are among the most popular discourses in urban policy circles. Most attempts at using AI to improve efficiencies in cities have nevertheless either struggled or failed to accomplish the smart city transformation. This is mainly due to short-sighted, technologically determined and reductionist AI approaches being applied to complex urbanization problems. Besides this, as smart cities are underpinned by our ability to engage with our environments, analyze them, and make efficient, sustainable and equitable decisions, the need for a green AI approach is intensified. This perspective paper, reflecting authors’ opinions and interpretations, concentrates on the “green AI” concept as an enabler of the smart city transformation, as it offers the opportunity to move away from purely technocentric efficiency solutions towards efficient, sustainable and equitable solutions capable of realizing the desired urban futures. The aim of this perspective paper is two-fold: first, to highlight the fundamental shortfalls in mainstream AI system conceptualization and practice, and second, to advocate the need for a consolidated AI approach—i.e., green AI—to further support smart city transformation. The methodological approach includes a thorough appraisal of the current AI and smart city literatures, practices, developments, trends and applications. The paper informs authorities and planners on the importance of the adoption and deployment of AI systems that address efficiency, sustainability and equity issues in cities.","RAYYAN-INCLUSION: {""Maria""=>""Included""} | RAYYAN-LABELS: urban","https://doi.org/10.3390/su13168952",NA,NA,NA
"rayyan-130074856","Toward urban sustainability and clean potable water: Prediction of water quality via artificial neural networks",NA,1,1,NA,NA,NA,NA,NA,NA,NA,"en",NA,NA,"","RAYYAN-INCLUSION: {""Maria""=>""Included""} | RAYYAN-LABELS: urban | USER-NOTES: {""Maria""=>[""Water quality failure is a long-standing problem worldwide, causing illness, poisoning, disease outbreak, and claiming human lives in the urban communities. Potable water can be compromised due to a myriad of physical, operational, and environmental factors, such as contaminants intrusion into water pipelines, leaching, disinfection byproducts, chemical or microbial permeation, and pollution. The prediction of potable water quality has seldom been researched, while a novel automated model that offers a proactive approach can be developed to promote sustainability-based strategies. This paper elaborates the impacts of the aforementioned factors on the quality of potable water using the Artificial Neural Networks (ANNs) and risk analysis techniques. The ANN model was developed based on historical data obtained from the water distribution networks (WDNs) of the City of El Pedregal, Peru. "", ""The data were streamlined and fed to the neural network to be trained. Subsequent to multiple iterations via the scaled conjugate gradient algorithm, the optimized performance was generated and passed to the trained network to forecast the water quality failure in WDNs. The model performance was tested and validated against different statistical error terms and indicators. The mean absolute error and root-mean-squared error in the ANN failure prediction were computed as 0.08 and 0.15, whereas the average validity of the network was generated to be 92%. Based on the trained neural network, the degree of influence of each factor was determined through implementing a sensitivity analysis. It was found that water quality, water pressure, and operational and maintenance practices had the maximum influence on the risk of failure in water infrastructure."", ""Policy makers and managers can benefit from the proposed model since ANN is already trained, by predicting water quality whenever new data become available. Prediction results will indicate the level of risk (low, moderate, high) to the inhabitants, thereby preemptive measures can be taken to avoid any illness or disease outbreak.""]}","https://doi.org/10.1016/j.jclepro.2020.125266",NA,NA,NA
