"key","title","year","month","day","journal","issn","volume","issue","pages","authors","url","language","publisher","location","abstract","notes","doi","keywords","pubmed_id","pmc_id"
"rayyan-131797078","Unlocking the Future: Fostering Human–Machine Collaboration and Driving Intelligent Automation through Industry 5.0 in Smart Cities",NA,1,1,NA,NA,NA,NA,NA,NA,NA,"en",NA,NA,"In the quest to meet the escalating demands of citizens, future smart cities emerge as crucial entities. Their role becomes even more vital given the current challenges posed by rapid urbanization and the need for sustainable and inclusive living spaces. At the heart of these future smart cities are advancements in information and communication technologies, with Industry 5.0 playing an increasingly significant role. This paper endeavors to conduct an exhaustive survey to analyze future technologies, including the potential of Industry 5.0 and their implications for smart cities. The crux of the paper is an exploration of technological advancements across various domains that are set to shape the future of urban environments. The discussion spans diverse areas including but not limited to cyber–physical systems, fog computing, unmanned aerial vehicles, renewable energy, machine learning, deep learning, cybersecurity, and digital forensics. Additionally, the paper sheds light on the specific role of Industry 5.0 in the smart city context, illuminating its impact on enabling advanced cybersecurity measures, fostering human–machine collaboration, driving intelligent automation in urban services, and refining data management and decision making. The paper also offers an in-depth review of the existing frameworks that are shaping smart city applications, evaluating how Industry 5.0 technologies could augment these frameworks. In particular, the paper delves into the various technological challenges that smart cities face, bringing potential Industry 5.0-enabled solutions to the fore.","RAYYAN-INCLUSION: {""Maria""=>""Included""} | RAYYAN-LABELS: urban","https://doi.org/10.3390/smartcities6050124",NA,NA,NA
"rayyan-131797080","A spatio-temporal analysis investigating completeness and inequalities of global urban building data in OpenStreetMap",NA,1,1,NA,NA,NA,NA,NA,NA,NA,"en",NA,NA,"Abstract OpenStreetMap (OSM) has evolved as a popular dataset for global urban analyses, such as assessing progress towards the Sustainable Development Goals. However, many analyses do not account for the uneven spatial coverage of existing data. We employ a machine-learning model to infer the completeness of OSM building stock data for 13,189 urban agglomerations worldwide. For 1,848 urban centres (16% of the urban population), OSM building footprint data exceeds 80% completeness, but completeness remains lower than 20% for 9,163 cities (48% of the urban population). Although OSM data inequalities have recently receded, partially as a result of humanitarian mapping efforts, a complex unequal pattern of spatial biases remains, which vary across various human development index groups, population sizes and geographic regions. Based on these results, we provide recommendations for data producers and urban analysts to manage the uneven coverage of OSM data, as well as a framework to support the assessment of completeness biases.","RAYYAN-INCLUSION: {""Maria""=>""Included""} | RAYYAN-LABELS: urban","https://doi.org/10.1038/s41467-023-39698-6",NA,NA,NA
"rayyan-131797081","Smart cities and sustainable development goals (SDGs): A systematic literature review of co-benefits and trade-offs",NA,1,1,NA,NA,NA,NA,NA,NA,NA,"en",NA,NA,"Despite the wealth of research on smart cities, there is a lack of studies examining interlinkages between smart cities and Sustainable Development Goals (SDGs). In other words, there is limited research on how implementing smart city solutions can lead to co-benefits and/or trade-offs for achieving SDGs. This systematic literature review was conducted to fill this gap. Results show that responsible development/implementation of smart city solutions and technologies could contribute to the progress toward SDGs. The literature is mainly focused on SDG 11 (Sustainable Cities and Communities), SDG 12 (Responsible Consumption and Production), SDG 7 (Affordable and Clean Energy), and SDG 6 (Clean Water and Sanitation). More work on other SDGs is needed. There is a bias toward reporting the benefits of smart cities. These include accelerating economic growth, improving efficiency, strengthening innovation, and raising citizen awareness. These benefits indicate that smart cities could catalyze the transition to sustainable development and address climate change challenges. However, this requires addressing trade-offs related to issues such as privacy and cyber security, costs of infrastructure upgrading, rebound effects associated with efficiency improvements, biased decision-making, reproduction of social biases, digital divide and lack of skills, misuse of AI, and limited legal setup. This review elaborates on these trade-offs and offers solutions to minimize them. Results show that the COVID-19 pandemic has increased attention to the interactions between smart cities and the SDGs, particularly those related to health and climate action. However, it has also cemented many new unethical practices. This review highlights governance/policy challenges that should be addressed to ensure smart cities can better contribute to the SDGs. It concludes that multi-scale and transparent governance mechanisms and regulatory frameworks are crucial for ensuring that smart city solutions support the transition toward sustainable and resilient cities.","RAYYAN-INCLUSION: {""Maria""=>""Included""} | RAYYAN-LABELS: urban","https://doi.org/10.1016/j.cities.2023.104659",NA,NA,NA
"rayyan-131797082","Designing climate resilient energy systems in complex urban areas considering urban morphology: A technical review",NA,1,1,NA,NA,NA,NA,NA,NA,NA,"en",NA,NA,"The urban energy infrastructure is facing a rising number of challenges due to climate change and rapid urbanization. In particular, the link between urban morphology and energy systems has become increasingly crucial as cities continue to expand and become more densely populated. Achieving climate neutrality adds another layer of complexity, highlighting the need to address this relationship to develop effective strategies for sustainable urban energy infrastructure. The occurrence of extreme climate events can also trigger cascading failures in the system components, leading to long-lasting blackouts. This review paper thoroughly explores the challenges of incorporating urban morphology into energy system models through a comprehensive literature review and proposes a new framework to enhance the resilience of interconnected systems. The review emphasizes the need for integrated models to provide deeper insights into urban energy systems design and operation and addresses the cascading failures, interconnectivity, and compound impacts of climate change and urbanization on energy systems. It also explores emerging challenges and opportunities, including the requirement for high-quality data, utilization of big data, and integration of advanced technologies like artificial intelligence and machine learning in urban energy systems. The proposed framework integrates urban morphology classification, mesoscale and microscale climate data, and a design and operation process to consider the influence of urban morphology, climate variability, and extreme events. Given the prevalence of extreme climate events and the need for climate-resilient strategies, the study underscores the significance of improving energy system models to accommodate future climate variations while recognizing the interconnectivity within urban infrastructure.","RAYYAN-INCLUSION: {""Maria""=>""Included""} | RAYYAN-LABELS: urban","https://doi.org/10.1016/j.adapen.2023.100155",NA,NA,NA
"rayyan-131797084","Monitoring the population change and urban growth of four major Pakistan cities through spatial analysis of open source data",NA,1,1,NA,NA,NA,NA,NA,NA,NA,"en",NA,NA,"Cities are complex and dynamic entities in close proximity of people, implying multi temporal observations to analyse and understand the urban context. At present, open-source data and geospatial intelligence are becoming the important means of exploring, monitoring and predicting urban status of area growth and population increase. In last few decades, unemployment and absence of infrastructures in the rural areas promoted the unplanned and haphazard urbanization across the urban centres in Pakistan. This study focuses on exploring the potential of open-source/freely available datasets for city mapping and monitoring spatially. The study gives a spatial perspective of rapidly growing cities of Pakistan using Google Earth Engine to classify Landsat images over last four decades, and discovers sprawl patterns across cities. The study works out that the built-up area is significantly increasing with population growth over four decades and there is a strong positive correlation between population growth and built-up expansion. Using Open-Source Data (Landsat images and LandScan data), this study has offered a technical solution of Google Earth Engine-supported analysis of statistics and machine learning to spatially monitoring the population change and urban growth of four major Pakistan cities. It is undoubted that our working results will provide the timely and cost-effective information to policymakers, Govt Officials and citizens for more sustainable urbanization.","RAYYAN-INCLUSION: {""Maria""=>""Included""} | RAYYAN-LABELS: urban","https://doi.org/10.1080/19475683.2023.2166989",NA,NA,NA
"rayyan-131797087","Technological advancements toward smart energy management in smart cities",NA,1,1,NA,NA,NA,NA,NA,NA,NA,"en",NA,NA,"This comprehensive review paper examines the technological advancements towards smart energy management in smart cities. It provides an overview of the concept of smart energy management, the challenges faced by cities in managing their energy consumption, and the need for technological advancements to overcome these challenges. The advancements are categorized based on their applications, such as smart grids, smart buildings, and smart transportation, and their benefits are discussed, including increased efficiency, reduced costs, and better sustainability. The paper also presents case studies of successful implementation of smart energy management technologies and discusses the challenges faced during implementation and how they were overcome. In addition, the paper highlights potential research areas and emerging technologies, including block chain, edge computing, IoT, big data analytics, energy harvesting technologies, machine learning, and distributed energy resources (DERs). The importance of technological advancements for smart energy management in smart cities is emphasized, and recommendations for future research and development in the field are provided. Overall, this review paper contributes to the ongoing development of smart cities and provides valuable insights for researchers, industry professionals, and policymakers working towards a more sustainable future.","RAYYAN-INCLUSION: {""Maria""=>""Included""} | RAYYAN-LABELS: urban","https://doi.org/10.1016/j.egyr.2023.07.021",NA,NA,NA
"rayyan-131797088","Eyes in the Sky: Drones Applications in the Built Environment under Climate Change Challenges",NA,1,1,NA,NA,NA,NA,NA,NA,NA,"en",NA,NA,"This paper reviews the diverse applications of drone technologies in the built environment and their role in climate change research. Drones, or unmanned aerial vehicles (UAVs), have emerged as valuable tools for environmental scientists, offering new possibilities for data collection, monitoring, and analysis in the urban environment. The paper begins by providing an overview of the different types of drones used in the built environment, including quadcopters, fixed-wing drones, and hybrid models. It explores their capabilities and features, such as high-resolution cameras, LiDAR sensors, and thermal imaging, which enable detailed data acquisition for studying climate change impacts in urban areas. The paper then examines the specific applications of drones in the built environment and their contribution to climate change research. These applications include mapping urban heat islands, assessing the energy efficiency of buildings, monitoring air quality, and identifying sources of greenhouse gas emissions. UAVs enable researchers to collect spatially and temporally rich data, allowing for a detailed analysis and identifying trends and patterns. Furthermore, the paper discusses integrating UAVs with artificial intelligence (AI) to derive insights and develop predictive models for climate change mitigation and adaptation in urban environments. Finally, the paper addresses drone technologies’ challenges and the future directions in the built environment. These challenges encompass regulatory frameworks, privacy concerns, data management, and the need for an interdisciplinary collaboration. By harnessing the potential of drones, environmental scientists can enhance their understanding of climate change impacts in urban areas and contribute to developing sustainable strategies for resilient cities.","RAYYAN-INCLUSION: {""Maria""=>""Included""} | RAYYAN-LABELS: urban","https://doi.org/10.3390/drones7100637",NA,NA,NA
"rayyan-131797089","Smart management of combined sewer overflows: From an ancient technology to artificial intelligence",NA,1,1,NA,NA,NA,NA,NA,NA,NA,"en",NA,NA,"Abstract Sewer systems are an essential part of sanitation infrastructure for protecting human and ecosystem health. Initially, they were used to solely convey stormwater, but over time municipal sewage was discharged to these conduits and transformed them into combined sewer systems (CSS). Due to climate change and rapid urbanization, these systems are no longer sufficient and overflow in wet weather conditions. Mechanistic and data‐driven models have been frequently used in research on combined sewer overflow (CSO) management integrating low‐impact development and gray‐green infrastructures. Recent advances in measurement, communication, and computation technologies have simplified data collection methods. As a result, technologies such as artificial intelligence (AI), geographic information system, and remote sensing can be integrated into CSO and stormwater management as a part of the smart city and digital twin concepts to build climate‐resilient infrastructures and services. Therefore, smart management of CSS is now both technically and economically feasible to tackle the challenges ahead. This review article explores CSO characteristics and associated impact on receiving waterbodies, evaluates suitable models for CSO management, and presents studies including above‐mentioned technologies in the context of smart CSO and stormwater management. Although integration of all these technologies has a big potential, further research is required to achieve AI‐controlled CSS for robust and agile CSO mitigation. This article is categorized under: Engineering Water &gt; Sustainable Engineering of Water Science of Water &gt; Water and Environmental Change","RAYYAN-INCLUSION: {""Maria""=>""Included""} | RAYYAN-LABELS: urban","https://doi.org/10.1002/wat2.1635",NA,NA,NA
"rayyan-131797090","The integration of artificial intelligence in cybersecurity measures for sustainable finance platforms: An analysis",NA,1,1,NA,NA,NA,NA,NA,NA,NA,"en",NA,NA,"This study delves into the integration of Artificial Intelligence (AI) in cybersecurity measures within smart cities, aiming to uncover both the challenges and opportunities this fusion presents. With the burgeoning reliance on interconnected digital infrastructures and the vast data ecosystems within urban environments, smart cities are increasingly susceptible to sophisticated cyber threats. Through a systematic literature review and content analysis, this research identifies the unique cybersecurity vulnerabilities faced by smart cities and evaluates how AI technologies can fortify urban cybersecurity frameworks. The methodology encompasses a comprehensive review of recent scholarly articles, industry reports, and case studies to assess the role of AI in enhancing threat detection, response, and prevention mechanisms. Key findings reveal that AI-driven cybersecurity solutions significantly enhance the resilience of smart cities against cyber threats by providing advanced analytical capabilities and real-time threat intelligence. However, the study also highlights the critical need for robust ethical and privacy considerations in the deployment of AI technologies. Strategic recommendations are provided for policymakers, urban planners, and technology leaders, emphasizing the importance of integrating secure AI-enabled infrastructure and fostering public-private partnerships. The study concludes with suggestions for future research directions, focusing on the ethical implications of AI in cybersecurity and the development of scalable AI solutions for diverse urban contexts. Keywords: Artificial Intelligence, Cybersecurity, Smart Cities, Urban Resilience.","RAYYAN-INCLUSION: {""Maria""=>""Included""} | RAYYAN-LABELS: urban","https://doi.org/10.51594/csitrj.v5i6.1195",NA,NA,NA
"rayyan-131797091","Towards Automated Urban Planning: When Generative and ChatGPT-like AI Meets Urban Planning",NA,1,1,NA,NA,NA,NA,NA,NA,NA,"en",NA,NA,"The two fields of urban planning and artificial intelligence (AI) arose and developed separately. However, there is now cross-pollination and increasing interest in both fields to benefit from the advances of the other. In the present paper, we introduce the importance of urban planning from the sustainability, living, economic, disaster, and environmental perspectives. We review the fundamental concepts of urban planning and relate these concepts to crucial open problems of machine learning, including adversarial learning, generative neural networks, deep encoder-decoder networks, conversational AI, and geospatial and temporal machine learning, thereby assaying how AI can contribute to modern urban planning. Thus, a central problem is automated land-use configuration, which is formulated as the generation of land uses and building configuration for a target area from surrounding geospatial, human mobility, social media, environment, and economic activities. Finally, we delineate some implications of AI for urban planning and propose key research areas at the intersection of both topics.","RAYYAN-INCLUSION: {""Maria""=>""Included""} | RAYYAN-LABELS: urban","https://doi.org/10.48550/arxiv.2304.03892",NA,NA,NA
"rayyan-131797092","Artificial intelligence and visual analytics in geographical space and cyberspace: Research opportunities and challenges",NA,1,1,NA,NA,NA,NA,NA,NA,NA,"en",NA,NA,"In recent decades, we have witnessed great advances on the Internet of Things, mobile devices, sensor-based systems, and resulting big data infrastructures, which have gradually, yet fundamentally influenced the way people interact with and in the digital and physical world. Many human activities now not only operate in geographical (physical) space but also in cyberspace. Such changes have triggered a paradigm shift in geographic information science (GIScience), as cyberspace brings new perspectives for the roles played by spatial and temporal dimensions, e.g., the dilemma of placelessness and possible timelessness. As a discipline at the brink of even bigger changes made possible by machine learning and artificial intelligence, this paper highlights the challenges and opportunities associated with geographical space in relation to cyberspace, with a particular focus on data analytics and visualization, including extended AI capabilities and virtual reality representations. Consequently, we encourage the creation of synergies between the processing and analysis of geographical and cyber data to improve sustainability and solve complex problems with geospatial applications and other digital advancements in urban and environmental sciences.","RAYYAN-INCLUSION: {""Maria""=>""Included""} | RAYYAN-LABELS: urban","https://doi.org/10.1016/j.earscirev.2023.104438",NA,NA,NA
"rayyan-131797093","Predicting Future Land Use Utilizing Economic and Land Surface Parameters with ANN and Markov Chain Models",NA,1,1,NA,NA,NA,NA,NA,NA,NA,"en",NA,NA,"The main aim of this study is to comprehensively analyze the dynamics of land use and land cover (LULC) changes in the Bathinda region of Punjab, India, encompassing historical, current, and future trends. To forecast future LULC, the Cellular Automaton–Markov Chain (CA) based on artificial neural network (ANN) concepts was used using cartographic variables such as environmental, economic, and cultural. For segmenting LULC, the study used a combination of ML models, such as support vector machine (SVM) and Maximum Likelihood Classifier (MLC). The study is empirical in nature, and it employs quantitative analyses to shed light on LULC variations through time. The result indicates that the barren land is expected to shrink from 55.2 km2 in 1990 to 5.6 km2 in 2050, signifying better land management or increasing human activity. Vegetative expanses, on the other hand, are expected to rise from 81.3 km2 in 1990 to 205.6 km2 in 2050, reflecting a balance between urbanization and ecological conservation. Agricultural fields are expected to increase from 2597.4 km2 in 1990 to 2859.6 km2 in 2020 before stabilizing at 2898.4 km2 in 2050. Water landscapes are expected to shrink from 13.4 km2 in 1990 to 5.6 km2 in 2050, providing possible issues for water resources. Wetland regions are expected to decrease, thus complicating irrigation and groundwater reservoir sustainability. These findings are confirmed by strong statistical indices, with this study’s high kappa coefficients of Kno (0.97), Kstandard (0.95), and Klocation (0.97) indicating a reasonable level of accuracy in CA prediction. From the result of the F1 score, a significant issue was found in MLC for segmenting vegetation, and the issue was resolved in SVM classification. The findings of this study can be used to inform land use policy and plans for sustainable development in the region and beyond.","RAYYAN-INCLUSION: {""Maria""=>""Included""} | RAYYAN-LABELS: urban","https://doi.org/10.3390/earth4030039",NA,NA,NA
"rayyan-131797094","Assessment of land use land cover change and its effects using artificial neural network-based cellular automation",NA,1,1,NA,NA,NA,NA,NA,NA,NA,"en",NA,NA,"Abstract The challenge of urban growth and land use land cover (LULC) change is particularly critical in developing countries. The use of remote sensing and GIS has helped to generate LULC thematic maps, which have proven immensely valuable in resource and land-use management, facilitating sustainable development by balancing developmental interests and conservation measures. The research utilized socio-economic and spatial variables such as slope, elevation, distance from streams, distance from roads, distance from built-up areas, and distance from the center of town to determine their impact on the LULC of 2016 and 2019. The research integrates Artificial Neural Network with Cellular Automta to forecast and establish potential land use changes for the years 2025 and 2040. Comparison between the predicted and actual LULC maps of 2022 indicates high agreement with kappa hat of 0.77 and a percentage of correctness of 86.83%. The study indicates that the built-up area will increase by 8.37 km 2 by 2040, resulting in a reduction of 7.08 km 2 and 1.16 km 2 in protected and agricultural areas, respectively. These findings will assist urban planners and lawmakers to adopt management and conservation strategies that balance urban expansion and conservation of natural resources leading to the sustainable development of the cities.","RAYYAN-INCLUSION: {""Maria""=>""Included""} | RAYYAN-LABELS: urban","https://doi.org/10.1186/s44147-024-00402-0",NA,NA,NA
